{
  "aggregate": {
    "phase": "authorized",
    "status": "running",
    "terminal_outcome": null,
    "wake_guard": null
  },
  "authority": {
    "approval_receipt_ref": "tracker:TASK-1#approval",
    "command": "deliver-to-pr",
    "effective_tier": "A",
    "envelope_digest": "sha256:0000000000000000000000000000000000000000000000000000000000000000",
    "envelope_ref": "planning/example/delivery-envelope.yml",
    "policy_digest": "sha256:0000000000000000000000000000000000000000000000000000000000000000",
    "policy_kind": "pilot-composite",
    "policy_ref": ".agents/skills/ai-playbook-deliver/manifest-lock.yml",
    "requested_tier": "A"
  },
  "budget": {},
  "candidate": {
    "base_sha": null,
    "builder_session_ids": [],
    "frozen_at": null,
    "head_sha": null,
    "merge_group_sha": null,
    "policy_sha": null,
    "ruleset_fingerprint": null,
    "tree_sha": null,
    "verification_environment_digest": null
  },
  "checks": {},
  "control_path": "mission.yml",
  "control_ref": "refs/heads/delivery-control/delivery-example",
  "controller": {
    "generation": 1,
    "session_id": "session-1",
    "workspace_id": "workspace-1"
  },
  "deployment": {},
  "findings": [],
  "interrupts": [],
  "metrics": {},
  "mission_id": "delivery-example",
  "operations": [],
  "prior_digest": null,
  "required_actions": [],
  "revision": 1,
  "schema_version": 1,
  "slices": {},
  "terminal": {},
  "updated_at": "2026-08-08T00:00:00Z"
}
